{
  "schema_version": 1,
  "step_s": 0.05,
  "bots": [
    {
      "id": "casual",
      "reaction_s": [
        0.3,
        0.7
      ],
      "aim_factor": [
        0.85,
        1.2
      ],
      "target_tension": 55.0,
      "hysteresis": 10.0,
      "jump_reaction_chance": 0.5
    },
    {
      "id": "skilled",
      "reaction_s": [
        0.2,
        0.45
      ],
      "aim_factor": [
        0.95,
        1.1
      ],
      "target_tension": 55.0,
      "hysteresis": 6.0,
      "jump_reaction_chance": 0.95
    }
  ],
  "campaign": {
    "max_attempts_per_day": 5,
    "bait_reserve": 25,
    "default_bait": "worm",
    "day_baits": {
      "6": "corn_dough",
      "9": "live_lambari",
      "10": "live_lambari"
    },
    "purchases": [
      {
        "kind": "rod",
        "id": "fiberglass"
      },
      {
        "kind": "upgrade",
        "id": "livewell",
        "level": 2
      },
      {
        "kind": "upgrade",
        "id": "motor",
        "level": 2
      },
      {
        "kind": "upgrade",
        "id": "sonar",
        "level": 2
      },
      {
        "kind": "rod",
        "id": "light_carbon"
      },
      {
        "kind": "upgrade",
        "id": "livewell",
        "level": 3
      },
      {
        "kind": "upgrade",
        "id": "motor",
        "level": 3
      },
      {
        "kind": "upgrade",
        "id": "sonar",
        "level": 3
      }
    ]
  },
  "balance": {
    "seeds": 20,
    "big_purchase_min_cost": 700,
    "targets": {
      "casual": {
        "day1_goal_rate_min": 0.6,
        "completion_rate_min": 0.9,
        "mean_attempts_per_day_max": 1.6,
        "big_purchase_interval_days": [
          2.0,
          3.5
        ]
      },
      "skilled": {
        "day1_goal_rate_min": 0.85,
        "completion_rate_min": 1.0,
        "mean_attempts_per_day_max": 1.2,
        "big_purchase_interval_days": [
          1.5,
          3.0
        ]
      }
    }
  }
}
